{
  "schema_version": "2.0",
  "product_id": "keyboard-example",
  "description": "A compact wireless keyboard for shared desks and occasional travel. Exact specifications and audience are undecided.",
  "research_question": "Which purchasing situations should we explore and what tradeoffs matter?"
}
